[
  {
    "schema_version": "1.0.0",
    "merchant_id": "mer_fynbos_atelier",
    "name": "Fynbos Atelier (fictional demo merchant)",
    "description": "Fictional Cape Town studio for breathable, rewearable dresses and summer layers.",
    "is_fictional": true,
    "location": "Cape Town (fictional business)",
    "catalogue_status": "ACTIVE",
    "created_at": "2026-10-17T18:00:00Z"
  },
  {
    "schema_version": "1.0.0",
    "merchant_id": "mer_karoo_cobble",
    "name": "Karoo & Cobble (fictional demo merchant)",
    "description": "Fictional Stellenbosch maker of shoes, leather goods and easy dresses.",
    "is_fictional": true,
    "location": "Stellenbosch (fictional business)",
    "catalogue_status": "ACTIVE",
    "created_at": "2026-10-17T18:00:00Z"
  },
  {
    "schema_version": "1.0.0",
    "merchant_id": "mer_tablebay_tailoring",
    "name": "Table Bay Tailoring (fictional demo merchant)",
    "description": "Fictional tailoring house for suits, blazers and finishing accessories.",
    "is_fictional": true,
    "location": "Cape Town (fictional business)",
    "catalogue_status": "ACTIVE",
    "created_at": "2026-10-17T18:00:00Z"
  }
]
